{
  "schema_version": "risk_alert_brief.v0",
  "case_id": "D-B-RT02",
  "session_id": "D-B-RT02-S04",
  "mode": "M1",
  "category": "E5",
  "category_family": "decision_quality_caution",
  "recommended_human_role": "bounded_review_or_caution",
  "handoff_focus": "preserve missing information and feasibility gaps before stronger recommendations are made",
  "support_artifact_policy_descriptor": "d_b_rt02_support_disclosure_discipline",
  "rationale": "Continue with caution because option work is ahead of full feasibility confirmation.",
  "active_flags": [
    {
      "flag_type": "decision_quality_risk",
      "title": "Option qualification may be ahead of informed consent",
      "severity": 2
    }
  ],
  "plugin_warnings": []
}
